{
  "contract_version": 2,
  "contract_id": "synthetic-source-dependency-graph-v2",
  "development_scope": "exposed_evaluator_development",
  "target_scope": {
    "signature": "declared signature fixture",
    "dimension": "four-dimensional fixture",
    "carrier": "finite cell-complex fixture",
    "domain": "connected bounded-domain fixture"
  },
  "bounded_search_source_ref": "search-record",
  "target_node_ids": [
    "local-object",
    "assembled-object"
  ],
  "required_arrow_ids": [
    "local-to-assembled"
  ],
  "source_references": [
    {
      "source_ref": "primary-local",
      "source_kind": "primary_source",
      "canonical_citation": "Synthetic primary source fixture, section 2",
      "locator": "primary-local.txt",
      "record_sha256": "cd81731ff77c2724e23163825d2d801233f21c6115228ccc79418fe30352bb1d"
    },
    {
      "source_ref": "primary-assembled",
      "source_kind": "primary_source",
      "canonical_citation": "Synthetic adjacent-source fixture, proposition 4",
      "locator": "primary-assembled.txt",
      "record_sha256": "36e5e63a842b10a910f19d42dece42ea3aedd2397000f6f2573f43f0424cb30f"
    },
    {
      "source_ref": "search-record",
      "source_kind": "bounded_search_record",
      "canonical_citation": "Synthetic bounded-search record fixture, version 1",
      "locator": "bounded-search.json",
      "record_sha256": "6202a89280d14800655368c10753029534119c40ed6ffcb6ce1d9aaa416a70b1"
    }
  ],
  "nodes": [
    {
      "node_id": "local-object",
      "statement": "The local object has the declared signed construction.",
      "scope": {
        "signature": "declared signature fixture",
        "dimension": "four-dimensional fixture",
        "carrier": "one finite cell",
        "domain": "local cell fixture"
      },
      "status": "exact_support",
      "source_refs": ["primary-local"],
      "assessment": "The cited primary fixture states this exact local construction."
    },
    {
      "node_id": "assembled-object",
      "statement": "The assembled object has the declared boundary construction.",
      "scope": {
        "signature": "declared signature fixture",
        "dimension": "four-dimensional fixture",
        "carrier": "assembled finite cell complex",
        "domain": "connected bounded-domain fixture"
      },
      "status": "adjacent_ingredient",
      "source_refs": ["primary-assembled"],
      "assessment": "The cited primary fixture supplies an adjacent boundary ingredient, not the exact assembled target."
    }
  ],
  "required_arrows": [
    {
      "arrow_id": "local-to-assembled",
      "source_node_id": "local-object",
      "target_node_id": "assembled-object",
      "compatibility_requirement": "Construct the declared assembly map while preserving the target scope.",
      "scope": {
        "signature": "declared signature fixture",
        "dimension": "four-dimensional fixture",
        "carrier": "directed local-to-assembled map",
        "domain": "connected bounded-domain fixture"
      },
      "status": "not_found_in_bounded_search",
      "source_refs": ["search-record"],
      "assessment": "The exact required arrow was not found within the cited bounded-search record."
    }
  ]
}
